{
  "$schema": "https://json-schema.org/draft/2020-12/schema",
  "$id": "https://example.invalid/schemas/operation-quote.schema.json",
  "title": "Canonical Operation Quote",
  "type": "object",
  "additionalProperties": false,
  "required": [
    "schemaVersion",
    "domain",
    "quoteId",
    "environment",
    "provider",
    "account",
    "deploymentId",
    "executionCapsuleHash",
    "sourceStateHash",
    "network",
    "assetRegistrySha256",
    "actions",
    "expectedResult",
    "generatedAt",
    "validUntil",
    "quoteNonce",
    "finalPayloadCommitmentProfile",
    "finalPayloadCommitment",
    "signatureState",
    "signature"
  ],
  "properties": {
    "schemaVersion": { "const": "1.0" },
    "domain": { "const": "ONE_INTENT_OPERATION_QUOTE_V1" },
    "quoteId": {
      "type": "string",
      "minLength": 8,
      "maxLength": 160,
      "pattern": "^[A-Za-z0-9._:-]+$"
    },
    "environment": {
      "enum": ["SIMULATION", "STAGING", "TESTNET", "PRODUCTION"]
    },
    "provider": {
      "type": "object",
      "additionalProperties": false,
      "required": ["providerId", "routeId", "authenticationState", "signerKeyId"],
      "properties": {
        "providerId": {
          "type": "string",
          "minLength": 3,
          "maxLength": 160,
          "pattern": "^[A-Za-z0-9._:-]+$"
        },
        "routeId": {
          "type": "string",
          "minLength": 3,
          "maxLength": 200,
          "pattern": "^[A-Za-z0-9._:-]+$"
        },
        "authenticationState": {
          "enum": ["SIMULATION_ONLY", "SIGNED_VERIFIED", "AUTHENTICATED_FIRST_PARTY_CHANNEL"]
        },
        "signerKeyId": {
          "type": ["string", "null"],
          "minLength": 1,
          "maxLength": 160
        }
      }
    },
    "account": {
      "type": "string",
      "pattern": "^0x[0-9a-fA-F]{40}$"
    },
    "deploymentId": {
      "type": "string",
      "minLength": 8,
      "maxLength": 160,
      "pattern": "^[A-Za-z0-9._:-]+$"
    },
    "executionCapsuleHash": {
      "type": "string",
      "pattern": "^0x[0-9a-f]{64}$"
    },
    "sourceStateHash": {
      "type": "string",
      "pattern": "^0x[0-9a-f]{64}$"
    },
    "network": {
      "type": "object",
      "additionalProperties": false,
      "required": [
        "sourceNetworkId",
        "sourceChainId",
        "destinationNetworkIds",
        "destinationChainIds",
        "networkRegistrySha256"
      ],
      "properties": {
        "sourceNetworkId": {
          "type": "string",
          "minLength": 3,
          "maxLength": 128,
          "pattern": "^[a-z0-9][a-z0-9._:-]+$"
        },
        "sourceChainId": {
          "oneOf": [
            { "type": "string", "pattern": "^[0-9]{1,20}$" },
            { "type": "null" }
          ]
        },
        "destinationNetworkIds": {
          "type": "array",
          "maxItems": 8,
          "uniqueItems": true,
          "items": {
            "type": "string",
            "minLength": 3,
            "maxLength": 128,
            "pattern": "^[a-z0-9][a-z0-9._:-]+$"
          }
        },
        "destinationChainIds": {
          "type": "array",
          "maxItems": 8,
          "uniqueItems": true,
          "items": { "type": "string", "pattern": "^[0-9]{1,20}$" }
        },
        "networkRegistrySha256": {
          "type": "string",
          "pattern": "^[0-9a-f]{64}$"
        }
      }
    },
    "assetRegistrySha256": {
      "type": "string",
      "pattern": "^[0-9a-f]{64}$"
    },
    "actions": {
      "type": "array",
      "minItems": 1,
      "maxItems": 32,
      "items": { "$ref": "#/$defs/action" }
    },
    "expectedResult": {
      "type": "object",
      "additionalProperties": false,
      "required": [
        "outputAssetId",
        "expectedOutput",
        "minimumOutput",
        "totalFeeExpected",
        "maximumTotalFee",
        "feeAssetId"
      ],
      "properties": {
        "outputAssetId": { "type": ["string", "null"], "maxLength": 200 },
        "expectedOutput": { "$ref": "#/$defs/decimalOrNull" },
        "minimumOutput": { "$ref": "#/$defs/decimalOrNull" },
        "totalFeeExpected": { "$ref": "#/$defs/decimal" },
        "maximumTotalFee": { "$ref": "#/$defs/decimal" },
        "feeAssetId": { "type": "string", "minLength": 1, "maxLength": 200 }
      }
    },
    "generatedAt": {
      "type": "string",
      "format": "date-time",
      "pattern": "^\\d{4}-\\d{2}-\\d{2}T\\d{2}:\\d{2}:\\d{2}Z$"
    },
    "validUntil": {
      "type": "string",
      "format": "date-time",
      "pattern": "^\\d{4}-\\d{2}-\\d{2}T\\d{2}:\\d{2}:\\d{2}Z$"
    },
    "quoteNonce": {
      "type": "string",
      "minLength": 16,
      "maxLength": 128,
      "pattern": "^[A-Za-z0-9._:-]+$"
    },
    "finalPayloadCommitmentProfile": {
      "const": "ONE_INTENT_FINAL_PAYLOAD_COMMITMENT_V1"
    },
    "finalPayloadCommitment": {
      "oneOf": [
        { "type": "string", "pattern": "^0x[0-9a-f]{64}$" },
        { "type": "null" }
      ]
    },
    "signatureState": {
      "enum": ["SIMULATION_ONLY", "SIGNED"]
    },
    "signature": {
      "oneOf": [
        { "$ref": "#/$defs/signature" },
        { "type": "null" }
      ]
    }
  },
  "$defs": {
    "decimal": {
      "type": "string",
      "pattern": "^(0|[1-9][0-9]*)(\\.[0-9]+)?$",
      "maxLength": 100
    },
    "decimalOrNull": {
      "oneOf": [
        { "$ref": "#/$defs/decimal" },
        { "type": "null" }
      ]
    },
    "hashOrNull": {
      "oneOf": [
        { "type": "string", "pattern": "^0x[0-9a-f]{64}$" },
        { "type": "null" }
      ]
    },
    "action": {
      "type": "object",
      "additionalProperties": false,
      "required": [
        "stepId",
        "type",
        "assetId",
        "quoteAssetId",
        "side",
        "positionEffect",
        "amount",
        "percent",
        "leverage",
        "recipient",
        "contractAddress",
        "limitPrice",
        "triggerPrice",
        "minimumOutput",
        "maximumFee",
        "maximumSlippageBps",
        "wirePayloadCommitment"
      ],
      "properties": {
        "stepId": {
          "type": "string",
          "minLength": 3,
          "maxLength": 160,
          "pattern": "^[A-Za-z0-9._:-]+$"
        },
        "type": {
          "enum": [
            "PERP_ORDER",
            "SPOT_ORDER",
            "USD_SEND",
            "SPOT_SEND",
            "WITHDRAW",
            "BRIDGE_DEPOSIT",
            "VAULT_DEPOSIT",
            "VAULT_WITHDRAW",
            "TOKEN_APPROVAL",
            "FEE_ASSET_PREPARE"
          ]
        },
        "assetId": { "type": ["string", "null"], "maxLength": 200 },
        "quoteAssetId": { "type": ["string", "null"], "maxLength": 200 },
        "side": { "enum": ["BUY", "SELL", "SEND", "DEPOSIT", "WITHDRAW", null] },
        "positionEffect": { "enum": ["OPEN", "REDUCE", "CLOSE", null] },
        "amount": { "$ref": "#/$defs/decimalOrNull" },
        "percent": { "$ref": "#/$defs/decimalOrNull" },
        "leverage": {
          "oneOf": [
            { "type": "integer", "minimum": 1, "maximum": 1000 },
            { "type": "null" }
          ]
        },
        "recipient": {
          "oneOf": [
            { "type": "string", "minLength": 1, "maxLength": 300 },
            { "type": "null" }
          ]
        },
        "contractAddress": {
          "oneOf": [
            { "type": "string", "pattern": "^0x[0-9a-fA-F]{40}$" },
            { "type": "null" }
          ]
        },
        "limitPrice": { "$ref": "#/$defs/decimalOrNull" },
        "triggerPrice": { "$ref": "#/$defs/decimalOrNull" },
        "minimumOutput": { "$ref": "#/$defs/decimalOrNull" },
        "maximumFee": { "$ref": "#/$defs/decimal" },
        "maximumSlippageBps": { "type": "integer", "minimum": 0, "maximum": 10000 },
        "wirePayloadCommitment": { "$ref": "#/$defs/hashOrNull" }
      }
    },
    "signature": {
      "type": "object",
      "additionalProperties": false,
      "required": ["profile", "keyId", "signatureBase64"],
      "properties": {
        "profile": { "const": "ONE_INTENT_ED25519_CANONICAL_JSON_V2" },
        "keyId": { "type": "string", "minLength": 1, "maxLength": 160 },
        "signatureBase64": { "type": "string", "minLength": 4, "maxLength": 256 }
      }
    }
  },
  "allOf": [
    {
      "if": {
        "properties": { "environment": { "const": "PRODUCTION" } },
        "required": ["environment"]
      },
      "then": {
        "properties": {
          "signatureState": { "const": "SIGNED" },
          "signature": { "$ref": "#/$defs/signature" },
          "finalPayloadCommitment": { "type": "string", "pattern": "^0x[0-9a-f]{64}$" },
          "provider": {
            "properties": {
              "authenticationState": {
                "enum": ["SIGNED_VERIFIED", "AUTHENTICATED_FIRST_PARTY_CHANNEL"]
              },
              "signerKeyId": { "type": "string", "minLength": 1, "maxLength": 160 }
            }
          }
        }
      }
    },
    {
      "if": {
        "properties": { "signatureState": { "const": "SIMULATION_ONLY" } },
        "required": ["signatureState"]
      },
      "then": {
        "properties": { "signature": { "type": "null" } }
      }
    }
  ]
}
